<?xml version="1.0" encoding="UTF-8"?>

<!DOCTYPE template-config PUBLIC
  "-//Megatome Technologies//DTD Frame2 Template Plugin 1.0//EN"
  "http://frame2.sourceforge.net/dtds/frame2-template_1_0.dtd">
 
<template-config>
	<templates>
		<template name="template1" path="xxx.jsp">
			<put name="header" path="yyy.jsp"/>
			<put name="nav" path="yyy.jsp"/>
			<put name="footer" path="yyy.jsp"/>
		</template>
      <template name="template2" path="template2.jsp">
         <put name="header" path="header2.jsp"/>
         <put name="nav" path="nav2.jsp"/>
         <put name="footer" path="footer2.jsp"/>
      </template>
      <template name="template3" path="template3.jsp">
         <put name="header" path="header2.jsp"/>
         <put name="nav" path="nav2.jsp"/>
         <put name="footer" path="footer2.jsp"/>
      </template>
      <template name="template_headeronly" path="template_headeronly.jsp">
         <put name="header" path="header2.jsp"/>
      </template>
      <template name="template_paramsonly" path="template_paramsonly.jsp">
         <put name="header" path="header2.jsp"/>
      </template>
      <template name="template_negativeget_name" path="template_negativeget_name.jsp">
         <put name="header" path="header2.jsp"/>
      </template>
   </templates>
</template-config>
