<?xml version="1.0" encoding="UTF-8"?>

<!DOCTYPE template-config PUBLIC
  "-//Megatome Technologies//DTD Frame2 Template Plugin 1.0//EN"
  "http://frame2.sourceforge.net/dtds/frame2-template_1_0.dtd">

<template-config>
<templates>
	<template name="xxx1" path="xxx.jsp">
		<put name="yyy1" path="yyy.jsp"/>
		<put name="yyy2" path="yyy.jsp"/>
	</template>
	<template name="xxx2" path="xxx.jsp"/>		
	<template name="xxx3" path="xxx.jsp">		
		<put name="yyy1" path="yyy.jsp"/>
	</template>
</templates>
</template-config>